{
  "base_version": "assumptions-v1",
  "assumptions": {
    "period": "month, 1,000 return requests (illustrative)",
    "logistics_returns_avoided": 80,
    "logistics_cost_per_return_eur": 6.5,
    "undue_discounts_avoided": 25,
    "avg_undue_discount_eur": 12.0,
    "minutes_saved": 240.0,
    "hourly_cost_eur": 22.0,
    "incentives_eur": 200.0,
    "system_cost_eur": 120.0,
    "error_cost_eur": 100.0,
    "abandonment_margin_lost_eur": 240.0,
    "incremental_margin_eur": 0.0
  },
  "note": "Carrier contract renegotiated: 6.50 EUR per return (hypothesis)",
  "author": "luca"
}
